{
  "schema_version": 2,
  "identity": {
    "provider": "self-hosted",
    "model": "Qwen/Qwen3.8-27B",
    "gpu": "h100-sxm-80gb",
    "serving_engine": "vllm",
    "precision": "bf16",
    "visual_token_budget": null,
    "concurrency": 1,
    "instance_type": null
  },
  "gpu_raw": "NVIDIA H100 80GB HBM3",
  "coefficients": {
    "wh_per_1k_input": null,
    "wh_per_1k_output": 1.9746443304721564,
    "wh_per_image": 0.0011115996619033286,
    "visual_tokens_per_image": 729,
    "intercept_wh": null
  },
  "provenance": {
    "tier": 0,
    "samples": 64,
    "energy_source": "nvmlDeviceGetTotalEnergyConsumption",
    "measurement_basis": "nvml_gpu_energy_batched",
    "energy_domain": "gpu_board",
    "energy_domain_includes": [
      "gpu_core",
      "hbm"
    ],
    "energy_domain_excludes": [
      "host_cpu",
      "host_dram",
      "nvlink_switch",
      "nic",
      "storage",
      "psu_loss",
      "cooling"
    ],
    "not_wall_power": true,
    "pue_applied": false,
    "grid_applied": false,
    "idle_subtracted": true,
    "idle_subtraction_method": "pre_post_average",
    "idle_watts_before": 121.049,
    "idle_watts_after": 139.291,
    "idle_drift_pct": 15.07,
    "concurrency": 1,
    "batch_size": 1,
    "fit": {
      "r2": 1.0,
      "condition_number": null,
      "input_ci95": [
        0.0,
        0.0
      ],
      "output_ci95": [
        0.0,
        0.0
      ],
      "image_ci95": [
        0.0,
        0.0
      ],
      "residuals_structured": false,
      "gate": {
        "protocol_version": "2.0",
        "max_relative_ci_half_width": 0.1,
        "max_condition_number": 30.0,
        "min_r2": 0.85,
        "design_leverage_multiple": 10.0,
        "design_idle_integration_uncertainty": 0.02,
        "prefill_arm_min_input_tokens": 1024,
        "prefill_arm_max_output_tokens": 8,
        "prefill_arm_min_rows": 2,
        "prefill_arm_min_span_tokens": 1024,
        "image_arm_min_rows_each": 2,
        "bootstrap_resamples": 500,
        "bootstrap_seed": 42
      }
    },
    "fit_engine": "amortization_1_over_c",
    "ci_method": "none",
    "raw_run_table": [
      {
        "n_images": 1,
        "text_tokens": 6272,
        "output_tokens": 4096,
        "energy_wh": 8.088143177613953,
        "raw_energy_wh": 10.953392222222222,
        "duration_ms": 85212.45157701196,
        "replicate": 0
      }
    ],
    "gpu_name": "NVIDIA H100 80GB HBM3",
    "gpu_canonical": "h100-sxm-80gb",
    "gpu_known": true,
    "serving_engine": "vllm",
    "server_version": "openai-compatible (Qwen/Qwen3.8-27B)",
    "image_set": "vetch_standard_v1",
    "image_resolution_px": 378,
    "model_supports_images": true,
    "visual_tokens_assumed": 729,
    "visual_tokens_assumed_source": "assumed_default",
    "vetch_version": "0.11.1",
    "methodology_version": "1.3",
    "measured_at": "2026-08-14T20:43:36Z",
    "measured_by": null,
    "calibration_mode": "batched",
    "requests_per_level": 64,
    "out_tokens_target": 64,
    "in_words": 96,
    "fixed_output_length": true,
    "achieved_concurrency": null,
    "amortization_curve": [
      {
        "concurrency": 1,
        "wh_per_1k_out": 1.974644,
        "wh_per_image": 0.001112,
        "achieved_concurrency": 0.0,
        "output_tokens": 4096,
        "wall_s": 85.212,
        "block_drift_pct": 7.06
      },
      {
        "concurrency": 2,
        "wh_per_1k_out": 1.007584,
        "wh_per_image": 0.003716,
        "achieved_concurrency": 0.0,
        "output_tokens": 4096,
        "wall_s": 44.961,
        "block_drift_pct": 0.12
      },
      {
        "concurrency": 4,
        "wh_per_1k_out": 0.518758,
        "wh_per_image": 0.009224,
        "achieved_concurrency": 0.0,
        "output_tokens": 4096,
        "wall_s": 22.78,
        "block_drift_pct": 1.37
      },
      {
        "concurrency": 8,
        "wh_per_1k_out": 0.285419,
        "wh_per_image": 0.010827,
        "achieved_concurrency": 0.0,
        "output_tokens": 4096,
        "wall_s": 11.79,
        "block_drift_pct": 3.59
      },
      {
        "concurrency": 16,
        "wh_per_1k_out": 0.170598,
        "wh_per_image": 0.010024,
        "achieved_concurrency": 0.0,
        "output_tokens": 4096,
        "wall_s": 6.463,
        "block_drift_pct": 1.3
      },
      {
        "concurrency": 32,
        "wh_per_1k_out": 0.107801,
        "wh_per_image": 0.014539,
        "achieved_concurrency": 0.0,
        "output_tokens": 4096,
        "wall_s": 3.767,
        "block_drift_pct": 0.14
      }
    ],
    "amortization_fit": {
      "a": 1.9272896521323584,
      "b": 0.04507544976941629,
      "r2": 0.9999588628727799
    },
    "api_backend": "openai",
    "device_id": 0,
    "driver_version": "590.48.01",
    "memory_total_mb": 81559,
    "power_before_w": 122.202,
    "power_after_w": 130.832,
    "block_drift_pct": 7.062077543739051,
    "clocks_before": {
      "sm_clock_mhz": 1980,
      "sm_max_clock_mhz": 1980,
      "mem_clock_mhz": 2619,
      "applications_sm_clock_mhz": 1980
    },
    "clocks_after": {
      "sm_clock_mhz": 1980,
      "sm_max_clock_mhz": 1980,
      "mem_clock_mhz": 2619,
      "applications_sm_clock_mhz": 1980
    },
    "gpu_shared_warning": false,
    "compute_process_count": 1,
    "device_count": 1,
    "timestamp": 1786740216.3176816,
    "schema_migration": [
      "Host block reconstructed after the fact rather than captured at measurement time; weaker evidence than a contemporaneous record.",
      "achieved_concurrency was recorded as 0.0 by a sampler that never observed the block in flight; reset to null (unknown)."
    ]
  },
  "active": true,
  "rejection_reasons": null,
  "timestamp": 1786740216.3176816,
  "profile_hash": "sha256:8a419f7ea0ed465aac85d06f25ae734865d94d507f68206f73b05876e678039f",
  "content_hash": "sha256:9b1f5e0344e9209aa3caac86ba402cdd3d79a2008ad47a1b9fe7764480cdbf57",
  "host": {
    "infrastructure_provider": "vast.ai",
    "provider_kind": "marketplace",
    "instance_type": null,
    "site": null,
    "region": null,
    "grid_zone": null,
    "country": null,
    "host_cpu": null,
    "host_cpu_cores": null,
    "gpu_form_factor": "sxm",
    "gpu_count_in_host": null,
    "tenancy": "unknown",
    "facility": {
      "pue": null,
      "pue_source": null,
      "pue_basis": null,
      "wue_l_per_kwh": null,
      "wue_source": null,
      "water_boundary": null,
      "water_accounting_kind": null,
      "grid_intensity_gco2_per_kwh": null,
      "grid_intensity_source": null,
      "grid_accounting_convention": null
    }
  },
  "measurement_conditions": {
    "enforced_power_limit_w": null,
    "sm_clock_locked": null,
    "sm_clock_mhz": null
  },
  "serving_config": {
    "engine": null,
    "engine_version": null,
    "prefix_caching": null,
    "speculative_decoding": null,
    "tensor_parallel_size": null,
    "flags_raw": null,
    "engine_specific": {}
  },
  "energy_basis": {
    "marginal": {
      "wh_per_1k_output": null,
      "idle_subtracted": true
    },
    "attributed": {
      "attribution_rule": "idle_amortised_over_measured_tokens",
      "levels": [
        {
          "assumed_utilisation": 0.2,
          "wh_per_1k_output": null
        },
        {
          "assumed_utilisation": 0.5,
          "wh_per_1k_output": null
        },
        {
          "assumed_utilisation": 0.8,
          "wh_per_1k_output": null
        }
      ]
    }
  },
  "node_power": {
    "available": false,
    "source": null,
    "board_wh": null,
    "node_wh": null,
    "node_to_board_ratio": null,
    "sampling_hz": null
  }
}
